{
  "schema_version": "1.0.0",
  "evidence_contract_version": "1.0.0",
  "evidence_cohorts": [
    {
      "cohort_id": "sha256:4a1cb4f7442df11244c14570cd1831aa43dbe04f711572c9790ebca131296f85",
      "fidelity_tier": "F1",
      "evidence_ids": [
        "sha256:8b0360d138623f0d15c2a0432818e20e327263da43500e485cd66da6031b4a09"
      ]
    }
  ],
  "tests": [
    {
      "test_netlist": "forward_01.cir",
      "analysis_type": "operating_point",
      "scalar_checks": [],
      "hard_bounds_checks": [
        {
          "name": "forward_voltage_maximum_at_1_a",
          "expression_source": {
            "kind": "raw_variable",
            "expression": "last(v(anode))"
          },
          "minimum": 0,
          "maximum": 0.82,
          "unit": "V",
          "inclusive": true,
          "datasheet_citation": "p. 1 product summary",
          "evidence_id": "sha256:8b0360d138623f0d15c2a0432818e20e327263da43500e485cd66da6031b4a09",
          "condition_id": "sha256:40a792cb5ff0ba235f92f2afdf4fbfb9a7718c68f8f32ea06fcaeea24174dd43",
          "citation_id": "sha256:1afdf12eebdd773cc33b21be4f9a998af174dd1e6bfdefcab48940ec996ce0c7",
          "cohort_id": "sha256:4a1cb4f7442df11244c14570cd1831aa43dbe04f711572c9790ebca131296f85",
          "bench_condition_id": "sha256:40a792cb5ff0ba235f92f2afdf4fbfb9a7718c68f8f32ea06fcaeea24174dd43",
          "evidence_role": "inclusive_maximum",
          "citation_locator": {
            "page": 1,
            "table": "product summary",
            "row": "Forward Voltage"
          },
          "evidence_qualification": {
            "test_mode": "not_stated"
          },
          "bench_qualification": {
            "test_mode": "continuous_dc"
          },
          "bench_equivalence_policy": "isothermal_diode_forward_projection",
          "placeholder": false
        }
      ]
    }
  ]
}
